id,text,number_count,information_count,person_count,address_count,sum_of_unique_entities,number_occurrences,information_occurrences,person_occurrences,address_occurrences
123991891,"УХВАЛА
23 грудня 2024 року
м. Київ
справа № 520/3458/24
адміністративне провадження № К/990/47763/24
Верховний Суд у складі судді-доповідача Касаційного адміністративного суду Чиркіна С.М. перевіривши касаційну скаргу Головного управління Пенсійного фонду України в Одеській області на рішення Харківського окружного адміністративного суду від 05.08.2024 та постанову Другого апеляційного адміністративного суду від 07.11.2024 у справі № 520/3458/24 за позовом ОСОБА_1 до Головного управління Пенсійного фонду України в Харківській області, Головного управління Пенсійного фонду України в Одеській області про визнання протиправними дій та зобов`язання вчинити дії,
УСТАНОВИВ:
ОСОБА_1 звернувся до суду із позовом до Головного управління Пенсійного фонду України в Харківській області, Головного управління Пенсійного фонду України в Одеській області, в якому просив:
визнати протиправним та скасувати рішення відповідача 2 про відмову у призначенні пенсії за віком на пільгових умовах позивачу від 18.01.2024 №203950009948;
зобов`язати відповідачів зарахувати позивачу період роботи з 02.07.2003 по 03.08.2016 до пільгового стажу, що дає право на пенсію за віком на пільгових умовах відповідно до пункту 1 частини другої статті 114 Закону України «Про загальнообов`язкове державне пенсійне страхування»;
зобов`язати відповідача 1 призначити позивачу пенсію за віком на пільгових умовах згідно пункту 1 частини другої статті 114 Закону України «Про загальнообов`язкове державне пенсійне страхування» з 08.11.2023 та провести відповідні виплати.
Рішенням Харківського окружного адміністративного суду від 05.08.2024, яке залишено без змін постановою Другого апеляційного адміністративного суду від 07.11.2024, позовну заяву ОСОБА_1 ( АДРЕСА_1 , РНОКПП: НОМЕР_1 ) до Головного управління Пенсійного фонду України в Харківській області (майдан Свободи, 5, Держпром, 3 під`їзд, 2 поверх, місто Харків, 61002 код ЄДРПОУ: 14099344) та до Головного управління Пенсійного фонду України в Одеській області (вулиця Канатна, будинок 83, місто Одеса, 65107, код ЄДРПОУ: 20987385) про визнання протиправним та скасування рішення, зобов`язання вчинити певні дії - задоволено частково.
Визнано протиправним та скасовано рішення Головного управління Пенсійного фонду України в Одеській області від 18.01.2024 №203950009948 про відмову у призначення пенсії.
Зобов`язано Головне управління Пенсійного фонду України в Одеській області при призначенні пенсії за віком на пільгових умовах за Списком №1 ОСОБА_1 зарахувати до пільгового стажу за Списком №1 період його роботи за професією машиніст електропоїзду (метрополітену) з 02.07.2003 по 03.08.2016.
Зобов`язано Головне управління Пенсійного фонду України в Одеській області призначити ОСОБА_1 пенсію за віком на пільгових умовах за Списком №1 виробництв, робіт, професій, посад і показників на підземних роботах, на роботах з особливо шкідливими і особливо важкими умовами праці, зайнятість в яких повний робочий день дає право на пенсію за віком на пільгових умовах, згідно пункту 1 частини другої статті 114 Закону України «Про загальнообов`язкове державне пенсійне страхування» від 09.07.2003 №1058-ІV, починаючи з дня звернення за призначенням пенсії - з 08.11.2023.
У задоволенні решти позовних вимог - відмовлено.
11.12.2024 до Касаційного адміністративного суду у складі Верховного Суду надійшла касаційна скарга Головного управління Пенсійного фонду України в Одеській області, в якій скаржник просить: скасувати рішення Харківського окружного адміністративного суду від 05.08.2024 та постанову Другого апеляційного адміністративного суду від 07.11.2024, та ухвалити постанову, якою відмовити в задоволенні позовних вимог.
Скаржник вказує, що позивач, ІНФОРМАЦІЯ_1 , 11.01.2024 звернувся до територіальних органів Пенсійного фонду України з заявою про призначення пенсії згідно статті 114 Закону України від 09.07.2003 № 1058-ІV «Про загальнообов`язкове державне пенсійне страхування».
Скаржник вважає, що при прийнятті оскаржуваних судових рішень судами було проігноровано той факт, що для того, щоб спірний період був зарахований до стажу роботи, що дає право на пенсію за Списком №1, необхідно його належним чином підтвердити.
Скаржник наголошує, що обов`язок в наданні достатнього пакету документів, які б підтверджували право на пенсію та періоди роботи на відповідних посадах лежить на особі, що звертається до органів Пенсійного фонду, а видавати такі документи та відповідно підтверджувати цим відповідні періоди роботи виключно підприємства, де працювала особа.
Скаржник вважає, що приймаючи рішення про відмову позивачу у призначенні пенсії на пільгових умовах він діяв згідно вимог чинного законодавства, тому що позивачем не підтверджено періоди роботи на пільгових умовах за Списком №1.
Перевіривши касаційну скаргу та додані до неї матеріали, суд приходить до наступного висновку.
У цій справі суд першої інстанції, врахувавши вимоги частин третьої та четвертої статті 257 Кодексу адміністративного судочинства України, розглянув справу за правилами спрощеного позовного провадження. За предметом спору дана справа не належить до тих, які повинні розглядатися виключно за правилами загального позовного провадження.
Відповідно до пункту 2 частини п`ятої статті 328 Кодексу адміністративного судочинства України (далі - КАС України) не підлягають касаційному оскарженню судові рішення у справах незначної складності та інших справах, розглянутих за правилами спрощеного позовного провадження (крім справ, які відповідно до цього Кодексу розглядаються за правилами загального позовного провадження), крім випадків, якщо а) касаційна скарга стосується питання права, яке має фундаментальне значення для формування єдиної правозастосовчої практики; б) особа, яка подає касаційну скаргу, відповідно до цього Кодексу позбавлена можливості спростувати обставини, встановлені оскарженим судовим рішенням, при розгляді іншої справи; в) справа становить значний суспільний інтерес або має виняткове значення для учасника справи, який подає касаційну скаргу; г) суд першої інстанції відніс справу до категорії справ незначної складності помилково.
Доведення вищезазначених обставин та, відповідно, права на касаційне оскарження судових рішень у справах незначної складності, покладається на особу, яка подає касаційну скаргу.
На виконання пункту 4 частини другої статті 330 Кодексу адміністративного судочинства України (далі - КАС України) у касаційній скарзі зазначаються: підставу (підстави), на якій (яких) подається касаційна скарга з визначенням передбаченої (передбачених) статтею 328 цього Кодексу підстави (підстав).
Вимоги пункту 4 частини другої статті 330 КАС України скаржник не виконав.
Пункт 4 частини п`ятої статті 332 КАС України встановлює, що касаційна скарга не приймається до розгляду і повертається суддею-доповідачем також, якщо: у касаційній скарзі не викладені передбачені цим Кодексом підстави для оскарження судового рішення в касаційному порядку.
Суд касаційної інстанції не може самостійно визначати підстави касаційного оскарження, оскільки такий обов`язок покладено на скаржника, так як в ухвалі про відкриття касаційного провадження зазначаються підстава (підстави) відкриття касаційного провадження, а в подальшому саме в межах доводів та вимог касаційної скарги, які стали підставою для відкриття касаційного провадження, суд касаційної інстанції переглядає судові рішення.
В той же час аргументи касаційної скарги зводяться до викладення обставин справи, цитування нормативно-правових актів, що не є належним правовим обґрунтуванням підстав касаційного оскарження судових рішень, передбачених частиною четвертою статті 328 КАС України.
За таких обставин касаційна скарга належить поверненню особі, яка її подала.
Керуючись статтями 328, 330, 332 КАС України,
У Х В А Л И В:
Касаційну скаргу Головного управління Пенсійного фонду України в Одеській області на рішення Харківського окружного адміністративного суду від 05.08.2024 та постанову Другого апеляційного адміністративного суду від 07.11.2024 у справі № 520/3458/24 за позовом ОСОБА_1 до Головного управління Пенсійного фонду України в Харківській області, Головного управління Пенсійного фонду України в Одеській області про визнання протиправними дій та зобов`язання вчинити дії - повернути особі, яка її подала.
Роз`яснити, що повернення касаційної скарги не позбавляє права повторного звернення до суду касаційної інстанції в порядку, встановленому законом.
Ухвала набирає законної сили з моменту її підписання суддею та не оскаржується.
Суддя - доповідач: С.М. Чиркін
 ",1,1,6,1,4,"[{'start': 1752, 'end': 1759, 'text': 'НОМЕР_1'}]","[{'start': 3695, 'end': 3707, 'text': 'ІНФОРМАЦІЯ_1'}]","[{'start': 461, 'end': 468, 'text': 'ОСОБА_1'}, {'start': 677, 'end': 684, 'text': 'ОСОБА_1'}, {'start': 1723, 'end': 1730, 'text': 'ОСОБА_1'}, {'start': 2482, 'end': 2489, 'text': 'ОСОБА_1'}, {'start': 2720, 'end': 2727, 'text': 'ОСОБА_1'}, {'start': 8015, 'end': 8022, 'text': 'ОСОБА_1'}]","[{'start': 1733, 'end': 1741, 'text': 'АДРЕСА_1'}]"
