id,text,number_count,information_count,person_count,address_count,sum_of_unique_entities,number_occurrences,information_occurrences,person_occurrences,address_occurrences
118433570,"ДОДАТКОВА ПОСТАНОВА
Іменем України
17 квітня 2024 року
м. Київ
справа №380/19884/21
адміністративне провадження №К/990/24741/22
Верховний Суд у складі колегії суддів Касаційного адміністративного суду:
головуючого - Чиркіна С.М.,
суддів: Єзерова А.А., Стародуба О.П.,
розглянувши у порядку письмового провадження заяву ОСОБА_1 про ухвалення додаткового судового рішення у справі №380/19884/21 за позовом ОСОБА_1 до ІНФОРМАЦІЯ_1 про визнання протиправною бездіяльності та зобов`язання вчинити дії,
У С Т А Н О В И В:
У листопаді 2021 року ОСОБА_1 (далі- ОСОБА_1 або позивач) звернувся до Львівського окружного адміністративного суду з позовом до ІНФОРМАЦІЯ_1 (далі - відповідач), в якому просив:
визнати протиправною бездіяльність відповідача, яка полягає у невиконанні обов`язку щодо визначення станом на 29.01.2020 та станом на 01.01.2021 розмірів посадового окладу і окладу за військовим званням позивача шляхом множення розміру прожиткового мінімуму для працездатних осіб, встановленого з 1 січня 2020 року Законом України від 14 листопада 2019 року № 294-ІХ «Про Державний бюджет України на 2020 рік», а з 01 січня 2021 року - Законом України від 15 грудня 2020 року № 1082-ІХ «Про Державний бюджет України на 2021 рік», на відповідний тарифний коефіцієнт згідно із додатками 1 та 14 до постанови Кабінету Міністрів України від 30 серпня 2017 року № 704 «Про грошове забезпечення військовослужбовців, осіб рядового і начальницького складу та деяких інших осіб» (далі - Постанова № 704), і подання відповідної інформації до ГУПФУ у Львівській області для перерахунку пенсії;
зобов`язати відповідача визначити станом на 29.01.2020 розміри посадового окладу і окладу за військовим званням позивача шляхом множення розміру прожиткового мінімуму для працездатних осіб, встановленого на 1 січня 2020 року Законом України від 14 листопада 2019 року № 294-ІХ «Про Державний бюджет України на 2020 рік», на відповідний тарифний коефіцієнт згідно з додатками 1 та 14 до постанови Кабінету Міністрів України № 704 та виготовити і подати до ГУПФУ у Львівській області оновлену довідку про розмір грошового забезпечення станом на 29.01.2020, у якій відобразити перераховані розміри посадового окладу і окладу за військовим званням та інших щомісячних основних і додаткових видів грошового забезпечення та премії для проведення перерахунку основного розміру пенсії у відповідності до вимог статей 43 і 63 Закону України від 09.04.1992 № 2262-XII «Про пенсійне забезпечення осіб, звільнених з військової служби, та деяких інших осіб» (далі - Закон № 2262-XII), починаючи з 01 лютого 2020 року;
зобов`язати відповідача визначити станом на 01.01.2021 розміри посадового окладу і окладу за військовим званням позивача шляхом множення розміру прожиткового мінімуму для працездатних осіб, встановленого на 1 січня 2021 року Законом України від 15 грудня 2020 року № 1082-ІХ «Про Державний бюджет України на 2021 рік», на відповідний тарифний коефіцієнт згідно з додатками 1 та 14 до постанови Кабінету Міністрів України № 704 та виготовити і подати до Головного управління Пенсійного фонду України у Львівській області оновлену довідку про розмір грошового забезпечення станом на 01 січня 2021 року, у якій відобразити перераховані розміри посадового окладу і окладу за військовим званням та інших щомісячних основний і додаткових видів грошового забезпечення та премії, для проведення перерахунку основного розміру пенсії у відповідності до вимог статей 43 і 63 Закону № 2262-XII, починаючи з 01 лютого 2021 року.
Львівський окружний адміністративний суд рішенням від 16.02.2022 позов задовольнив:
визнав протиправною бездіяльність ІНФОРМАЦІЯ_1 щодо відмови позивачу у підготовці та поданні до ГУПФУ у Львівській області оновлених довідок про розмір його грошового забезпечення станом на 29.01.2020 та станом на 01.01.2021 для перерахунку пенсії з урахуванням посадового окладу та окладу за військовим званням, виходячи з розміру прожиткового мінімуму для працездатних осіб, встановленого законом на 01 січня 2020 року та на 01 січня 2021 року відповідно, та множенням на відповідний тарифний коефіцієнт згідно з пунктом 4 постанови Кабінету Міністрів України № 704;
зобов`язав відповідача підготувати та подати до ГУПФУ у Львівській області оновлену довідку про розмір грошового забезпечення ОСОБА_1 станом на 29.01.2020 та станом на 01.01.2021 для перерахунку пенсії з урахуванням посадового окладу та окладу за військовим званням, виходячи з розміру прожиткового мінімуму для працездатних осіб, встановленого законом на 01 січня 2020 року та на 01 січня 2021 року відповідно, та множенням на відповідний тарифний коефіцієнт згідно з пунктом 4 постанови Кабінету Міністрів України № 704.
Восьмий апеляційний адміністративний суд постановою від 04.08.2022 скасував рішення суду першої інстанції і ухвалив нову постанову про відмову у задоволенні позову.
Верховний Суд постановою від 14.02.2024 скасував постанову Восьмого апеляційного адміністративного суду від 04.08.2022 і залишив в силі рішення Львівського окружного адміністративного суду від 16.02.2022.
12.03.2024 на адресу Верховного Суду від позивача надійшла заява про ухвалення додаткового судового рішення у справі, у якій останній просила вирішити питання розподілу судових витрат.
У зв`язку із надходженням цієї заяви судом касаційної інстанції на адресу суду першої інстанції було скеровано запит на витребовування справи задля вирішення питання про ухвалення додаткового судового рішення у порядку, встановленому статтею 252 КАС України.
На зазначений судовий запит 11.04.2024 адміністративна справа №380/19884/21 надійшла до Верховного Суду.
Ухвалою Верховного Суду від 17.04.2024 розгляд заяви ОСОБА_1 про ухвалення додаткового судового рішення у справі призначено до розгляду в порядку письмового провадження.
Верховний Суд розглянув зазначену заяву і дійшов висновку про наявність правових підстав для ухвалення додаткового судового рішення у справі, з огляду на таке.
Згідно з частиною першою статті 252 КАС України суд, що ухвалив судове рішення, може за заявою учасника справи чи з власної ініціативи ухвалити додаткове рішення, якщо, зокрема, судом не вирішено питання про судові витрати.
Заяву про ухвалення додаткового судового рішення може бути подано до закінчення строку на виконання судового рішення.
За змістом частини шостої статті 139 КАС України якщо суд касаційної інстанції, не повертаючи адміністративної справи на новий розгляд, ухвалить нове рішення, він відповідно змінює розподіл судових витрат.
Як свідчать обставини справи заявником за подання касаційної скарги до суду касаційної інстанції було сплачено судовий збір у розмірі 3632 грн, що підтверджується інформацією, зазначеною у квитанції ID №5664-0629-6592-1493 від 08.09.2022.
Відповідно до приписів пункту 4 частини першої статті 356 КАС України, постанова суду касаційної інстанції складається з резолютивної частини із зазначенням розподілу судових витрат, понесених у зв`язку з переглядом справи у суді касаційної інстанції.
Верховний Суд у цій справі, скасувавши постанову суду апеляційної інстанції та залишаючи в силі рішення суду першої інстанції про задоволення позову не вирішив питання про розподіл судових витрат, у зв`язку із чим колегія суддів вважає, що є підстави для ухвалення додаткової постанови про розподіл судових витрат.
Враховуючи зазначене, судові витрати, понесені позивачем на сплату судового збору за подання касаційної скарги, мають бути присуджені на його користь за рахунок бюджетних асигнувань відповідача у сумі у сумі 3632 грн.
Керуючись статтями 139, 252, 345, 359 КАС України, Суд
П О С Т А Н О В И В:
Заяву ОСОБА_1 про ухвалення додаткового судового рішення у справі № 380/19884/21 задовольнити.
Прийняти додаткову постанову у справі № 380/19884/21.
Стягнути на користь ОСОБА_1 ( АДРЕСА_1 ; РНОКПП НОМЕР_1 ) за рахунок бюджетних асигнувань ІНФОРМАЦІЯ_1 ( АДРЕСА_2 ; код ЄДРПОУ: НОМЕР_2 ) сплачений судовий збір за подання касаційної скарги у сумі 3632 (три тисячі шістсот тридцять дві) гривні 00 копійок.
Додаткова постанова набирає законної сили з дати її прийняття, є остаточною та оскарженню не підлягає.
Судді Верховного Суду: С. М. Чиркін
А. А. Єзеров
О. П. Стародуб
 ",2,4,8,2,4,"[{'start': 7769, 'end': 7776, 'text': 'НОМЕР_1'}, {'start': 7849, 'end': 7856, 'text': 'НОМЕР_2'}]","[{'start': 415, 'end': 427, 'text': 'ІНФОРМАЦІЯ_1'}, {'start': 645, 'end': 657, 'text': 'ІНФОРМАЦІЯ_1'}, {'start': 3617, 'end': 3629, 'text': 'ІНФОРМАЦІЯ_1'}, {'start': 7811, 'end': 7823, 'text': 'ІНФОРМАЦІЯ_1'}]","[{'start': 319, 'end': 326, 'text': 'ОСОБА_1'}, {'start': 404, 'end': 411, 'text': 'ОСОБА_1'}, {'start': 538, 'end': 545, 'text': 'ОСОБА_1'}, {'start': 553, 'end': 560, 'text': 'ОСОБА_1'}, {'start': 4278, 'end': 4285, 'text': 'ОСОБА_1'}, {'start': 5647, 'end': 5654, 'text': 'ОСОБА_1'}, {'start': 7578, 'end': 7585, 'text': 'ОСОБА_1'}, {'start': 7741, 'end': 7748, 'text': 'ОСОБА_1'}]","[{'start': 7751, 'end': 7759, 'text': 'АДРЕСА_1'}, {'start': 7826, 'end': 7834, 'text': 'АДРЕСА_2'}]"
117597840,"УХВАЛА
12 березня 2024 року
м. Київ
справа №580/5079/23
адміністративне провадження №К/990/7049/24
Верховний Суд у складі колегії суддів Касаційного адміністративного суду (далі - Суд):
судді-доповідача - Радишевської О.Р.,
суддів - Мацедонська В.Е., Смоковича М.І.,
перевіривши касаційну скаргу ОСОБА_1 , яка подана його представником - адвокатом Шаповаловим Андрієм Миколайовичем, на ухвалу Черкаського окружного адміністративного суду від 12 жовтня 2023 року та постанову Шостого апеляційного адміністративного суду від 23 січня 2024 року у справі №580/5079/23 за позовом ОСОБА_1 до військової частини НОМЕР_1 про визнання протиправним та скасування наказу,
УСТАНОВИВ:
ОСОБА_1 звернувся до суду з позовом до військової частини НОМЕР_1 , в якому просив:
- визнати протиправним та скасувати наказ командира військової частини НОМЕР_1 від 29 вересня 2022 року № 263, в частині пунктів 19 та 19.3 щодо сержанта ОСОБА_1 , ІНФОРМАЦІЯ_1 , РНОКПП: НОМЕР_2 , номера обслуги мінометного взводу мінометної батареї механізованої батальйону, а саме ""вважати таким, що самовільно залишив місце розташування АДРЕСА_1 з 29 вересня 2022 року"".
Ухвалою Черкаського окружного адміністративного суду від 12 жовтня 2023 року, залишеною без змін постановою Шостого апеляційного адміністративного суду від 23 січня 2024 року, позовну заяву залишено без розгляду на підставі пункту 8 частини першої статті 240 Кодексу адміністративного судочинства України.
23 лютого 2024 року до Верховного Суду надійшла касаційна скарга ОСОБА_1 , яка подана його представником - адвокатом Шаповаловим Андрієм Миколайовичем, на ухвалу Черкаського окружного адміністративного суду від 12 жовтня 2023 року та постанову Шостого апеляційного адміністративного суду від 23 січня 2024 року у справі №580/5079/23 .
За правилами частини першої статті 334 Кодексу адміністративного судочинства України (далі -КАС України) за відсутності підстав для залишення касаційної скарги без руху, повернення касаційної скарги чи відмови у відкритті касаційного провадження суд касаційної інстанції постановляє ухвалу про відкриття касаційного провадження у справі.
Згідно з пунктом 4 частини другої статті 330 КАС України у касаційній скарзі зазначається підстава (підстави), на якій (яких) подається касаційна скарга з визначенням передбаченої (передбачених) статтею 328 цього Кодексу підстави (підстав).
Відповідно до частини другої статті 328 КАС України та пункту 12 частини першої статті 294 КАС України у касаційному порядку можуть бути оскаржені, зокрема ухвали суду першої інстанції пр залишення позову (заяви) без розгляду, після їх перегляду в апеляційному порядку.
Приписами частини четвертої статті 328 КАС України врегульовано, що підставами касаційного оскарження судових рішень, зазначених у частинах другій і третій цієї статті, є неправильне застосування судом норм матеріального права чи порушення норм процесуального права.
У касаційній скарзі скаржник посилається на порушення судами попередніх інстанцій норм процесуального права.
Проаналізувавши доводи касаційної скарги, Суд дійшов висновку про існування підстав, передбачених частиною другою 328 КАС України та пунктом 12 частини першої статті 294 КАС України для відкриття касаційного провадження.
Касаційна скарга відповідає вимогам статті 330 КАС України, підстави для залишення касаційної скарги без руху, повернення чи відмови у відкритті касаційного провадження відсутні.
Керуючись статтями 248, 328, 330, 334, 337, 338 КАС України, Суд
УХВАЛИВ:
1. Відкрити касаційне провадження за касаційною скаргою ОСОБА_1 , яка подана його представником - адвокатом Шаповаловим Андрієм Миколайовичем, на ухвалу Черкаського окружного адміністративного суду від 12 жовтня 2023 року та постанову Шостого апеляційного адміністративного суду від 23 січня 2024 року у справі №580/5079/23.
2. Витребувати з Черкаського окружного адміністративного суду матеріали адміністративної справи №580/5079/23.
3. Особі, що подала касаційну скаргу, надіслати копію ухвали про відкриття касаційного провадження у справі, а іншим учасникам справи -копію ухвали про відкриття касаційного провадження у справі разом із копіями касаційної скарги та доданих до неї матеріалів.
4. Установити десятиденний строк з дня отримання копії цієї ухвали для подання відзиву на касаційну скаргу та роз`яснити, що до відзиву додаються докази надсилання (надання) його копій та доданих до нього документів іншим учасникам справи.
5. Роз`яснити, що особа, яка подала касаційну скаргу, має право доповнити чи змінити її протягом строку на касаційне оскарження, обґрунтувавши необхідність таких змін чи доповнень. У разі доповнення чи зміни касаційної скарги особа, яка подала касаційну скаргу, повинна подати докази надсилання копій відповідних доповнень чи змін до касаційної скарги іншим учасникам справи, інакше суд не враховує такі доповнення чи зміни.
Ухвала набирає законної сили з моменту її підписання суддями, є остаточною та не може бути оскаржена.
Суддя-доповідач: Судді:|О.Р. Радишевська В.Е. Мацедонська М.І. Смокович|
 ",4,1,6,1,4,"[{'start': 605, 'end': 612, 'text': 'НОМЕР_1'}, {'start': 730, 'end': 737, 'text': 'НОМЕР_1'}, {'start': 827, 'end': 834, 'text': 'НОМЕР_1'}, {'start': 943, 'end': 950, 'text': 'НОМЕР_2'}]","[{'start': 920, 'end': 932, 'text': 'ІНФОРМАЦІЯ_1'}]","[{'start': 296, 'end': 303, 'text': 'ОСОБА_1'}, {'start': 575, 'end': 582, 'text': 'ОСОБА_1'}, {'start': 672, 'end': 679, 'text': 'ОСОБА_1'}, {'start': 910, 'end': 917, 'text': 'ОСОБА_1'}, {'start': 1501, 'end': 1508, 'text': 'ОСОБА_1'}, {'start': 3526, 'end': 3533, 'text': 'ОСОБА_1'}]","[{'start': 1096, 'end': 1104, 'text': 'АДРЕСА_1'}]"
